{"assessed_at":"2026-10-07T06:02:58.659Z","checks":[{"boundary":"ACTIVE_TIME","checked_at":"2026-10-07T06:02:58.659Z","declared_limit":"4500000 ms","evidence_refs":[{"artifact_path":"admission/execution-manifest.json","artifact_sha256":"c39605d9b960dacf90d6d55523843d7e08b0e9def09fdbcb0b0263ea191986df"}],"observed":"716093 ms","result":"within_limits"},{"boundary":"TOTAL_TIME","checked_at":"2026-10-07T06:02:58.659Z","declared_limit":"5400000 ms","evidence_refs":[{"artifact_path":"admission/execution-manifest.json","artifact_sha256":"c39605d9b960dacf90d6d55523843d7e08b0e9def09fdbcb0b0263ea191986df"}],"observed":"1118947 ms","result":"within_limits"},{"boundary":"ESTIMATED_COST","checked_at":"2026-10-07T06:02:58.659Z","declared_limit":"5.00 USD","evidence_refs":[{"artifact_path":"admission/execution-manifest.json","artifact_sha256":"c39605d9b960dacf90d6d55523843d7e08b0e9def09fdbcb0b0263ea191986df"}],"observed":"0.22 USD","result":"within_limits"}],"execution_manifest_sha256":"c39605d9b960dacf90d6d55523843d7e08b0e9def09fdbcb0b0263ea191986df","reasons":[],"record_type":"safety_assessment","safety_status":"within_limits","schema_version":1,"variant_validation_id":"60511328-ab4d-4234-81ab-0b042a20e658"}
