{"assessed_at":"2026-10-07T05:43:17.004Z","checks":[{"boundary":"ACTIVE_TIME","checked_at":"2026-10-07T05:43:17.004Z","declared_limit":"4500000 ms","evidence_refs":[{"artifact_path":"admission/execution-manifest.json","artifact_sha256":"5ea4e7511b1528b46c6b7f3a3e0d6e1819a39ed832467ba33840a88198fc1afa"}],"observed":"1539192 ms","result":"within_limits"},{"boundary":"TOTAL_TIME","checked_at":"2026-10-07T05:43:17.004Z","declared_limit":"5400000 ms","evidence_refs":[{"artifact_path":"admission/execution-manifest.json","artifact_sha256":"5ea4e7511b1528b46c6b7f3a3e0d6e1819a39ed832467ba33840a88198fc1afa"}],"observed":"1983408 ms","result":"within_limits"},{"boundary":"ESTIMATED_COST","checked_at":"2026-10-07T05:43:17.004Z","declared_limit":"5.00 USD","evidence_refs":[{"artifact_path":"admission/execution-manifest.json","artifact_sha256":"5ea4e7511b1528b46c6b7f3a3e0d6e1819a39ed832467ba33840a88198fc1afa"}],"observed":"0.22 USD","result":"within_limits"}],"execution_manifest_sha256":"5ea4e7511b1528b46c6b7f3a3e0d6e1819a39ed832467ba33840a88198fc1afa","reasons":[],"record_type":"safety_assessment","safety_status":"within_limits","schema_version":1,"variant_validation_id":"eda6019a-0f5d-4565-a809-b129ec432036"}
