{"assessed_at":"2026-10-07T03:58:35.418Z","checks":[{"boundary":"ACTIVE_TIME","checked_at":"2026-10-07T03:58:35.418Z","declared_limit":"600000 ms","evidence_refs":[{"artifact_path":"admission/execution-manifest.json","artifact_sha256":"a1fd75394f2597338ef92b3c3bd946ac15aeb4aa34f1557e1ed54505c0111a4c"}],"observed":"453134 ms","result":"within_limits"},{"boundary":"TOTAL_TIME","checked_at":"2026-10-07T03:58:35.418Z","declared_limit":"1200000 ms","evidence_refs":[{"artifact_path":"admission/execution-manifest.json","artifact_sha256":"a1fd75394f2597338ef92b3c3bd946ac15aeb4aa34f1557e1ed54505c0111a4c"}],"observed":"679868 ms","result":"within_limits"},{"boundary":"ESTIMATED_COST","checked_at":"2026-10-07T03:58:35.418Z","declared_limit":"1.00 USD","evidence_refs":[{"artifact_path":"admission/execution-manifest.json","artifact_sha256":"a1fd75394f2597338ef92b3c3bd946ac15aeb4aa34f1557e1ed54505c0111a4c"}],"observed":"0.03 USD","result":"within_limits"}],"execution_manifest_sha256":"a1fd75394f2597338ef92b3c3bd946ac15aeb4aa34f1557e1ed54505c0111a4c","reasons":[],"record_type":"safety_assessment","safety_status":"within_limits","schema_version":1,"transport_probe_id":"4f4a29c7-a8ee-4d30-ac2a-5cc5be9f2ce5"}
