{"assessed_at":"2026-10-07T04:51:18.109Z","checks":[{"boundary":"ACTIVE_TIME","checked_at":"2026-10-07T04:51:18.109Z","declared_limit":"600000 ms","evidence_refs":[{"artifact_path":"admission/execution-manifest.json","artifact_sha256":"03586029b4faa11c0f4c14cc7ea0ad291b0afa25036c91639f97d02a35979a54"}],"observed":"474953 ms","result":"within_limits"},{"boundary":"TOTAL_TIME","checked_at":"2026-10-07T04:51:18.109Z","declared_limit":"1200000 ms","evidence_refs":[{"artifact_path":"admission/execution-manifest.json","artifact_sha256":"03586029b4faa11c0f4c14cc7ea0ad291b0afa25036c91639f97d02a35979a54"}],"observed":"716105 ms","result":"within_limits"},{"boundary":"ESTIMATED_COST","checked_at":"2026-10-07T04:51:18.109Z","declared_limit":"1.00 USD","evidence_refs":[{"artifact_path":"admission/execution-manifest.json","artifact_sha256":"03586029b4faa11c0f4c14cc7ea0ad291b0afa25036c91639f97d02a35979a54"}],"observed":"0.03 USD","result":"within_limits"}],"execution_manifest_sha256":"03586029b4faa11c0f4c14cc7ea0ad291b0afa25036c91639f97d02a35979a54","reasons":[],"record_type":"safety_assessment","safety_status":"within_limits","schema_version":1,"transport_probe_id":"adfca539-508f-4a51-9a98-e1dcf8cec84a"}
